{
  "schema_version":"1.0.0",
  "task_id":"RAG-SEARCH-STREAMING-TOPK",
  "repository":"pskeffington/agent_skills",
  "base_commit":"08c943a6ac24bf31e0491b054f6b93eacf07296f",
  "objective":"Reduce retrieval latency and temporary allocations for large indexes while preserving exact ordered search results.",
  "scope":{"include":["agent_toolset/rag.py","tests/test_rag.py","docs/benchmarks/rag-search-streaming-topk-2026-10-30.json","docs/IMPLEMENTATION_QUEUE.md","docs/TEST_MATRIX.md","examples/rag-search-streaming-topk-task.json","scripts/validate.py","docs/reviews/rag-search-streaming-topk-review-2026-10-30.md"],"exclude":["ranking formula changes","third-party dependencies","deployment"]},
  "acceptance":["Baseline and candidate produce exactly equal ordered hits, scores, and provenance for representative queries.","Stable tie ordering, score accumulation order, zero-frequency key behavior, and search limits remain covered.","Paired measurements cover a 20,000-line synthetic corpus and the repository corpus with latency and peak allocation recorded.","Independent code review passes.","Full repository validation passes and release gates remain fail-closed."],
  "risk":"medium",
  "owner_role":"implementer",
  "status":"done",
  "depends_on":[],
  "evidence_refs":["docs/benchmarks/rag-search-streaming-topk-2026-10-30.json","docs/IMPLEMENTATION_QUEUE.md R19"],
  "blocker":null,
  "approval_ref":null
}
